{
  "$schema": "https://json-schema.org/draft/2020-12/schema",
  "$id": "https://example.local/schemas/bible-connections.schema.json",
  "title": "Bible Connections Session Pack",
  "type": "object",
  "additionalProperties": false,
  "required": [
    "$schema",
    "game",
    "version",
    "displayName",
    "roundsPerSession",
    "sessions"
  ],
  "properties": {
    "$schema": {
      "type": "string"
    },
    "game": {
      "const": "bible-connections"
    },
    "version": {
      "type": "integer",
      "minimum": 1
    },
    "displayName": {
      "type": "string",
      "minLength": 1
    },
    "roundsPerSession": {
      "type": "integer",
      "minimum": 1
    },
    "sessions": {
      "type": "array",
      "minItems": 1,
      "items": {
        "$ref": "#/$defs/session"
      }
    }
  },
  "$defs": {
    "session": {
      "type": "object",
      "additionalProperties": false,
      "required": [
        "id",
        "title",
        "theme",
        "rounds"
      ],
      "properties": {
        "id": {
          "type": "string",
          "pattern": "^[a-z0-9-]+$"
        },
        "title": {
          "type": "string",
          "minLength": 1
        },
        "theme": {
          "type": "string",
          "minLength": 1
        },
        "rounds": {
          "type": "array",
          "minItems": 1,
          "items": {
            "$ref": "#/$defs/round"
          }
        }
      }
    },
    "round": {
      "type": "object",
      "additionalProperties": false,
      "required": [
        "id",
        "title",
        "groups",
        "difficulty",
        "teachingNote"
      ],
      "properties": {
        "id": {
          "type": "string",
          "pattern": "^[a-z0-9-]+$"
        },
        "title": {
          "type": "string",
          "minLength": 1
        },
        "groups": {
          "type": "array",
          "minItems": 4,
          "maxItems": 4,
          "items": {
            "$ref": "#/$defs/group"
          }
        },
        "difficulty": {
          "type": "string",
          "enum": [
            "easy",
            "medium",
            "hard"
          ]
        },
        "teachingNote": {
          "type": "string",
          "minLength": 1
        }
      }
    },
    "group": {
      "type": "object",
      "additionalProperties": false,
      "required": [
        "id",
        "category",
        "items"
      ],
      "properties": {
        "id": {
          "type": "string",
          "pattern": "^[a-z0-9-]+$"
        },
        "category": {
          "type": "string",
          "minLength": 1
        },
        "items": {
          "type": "array",
          "minItems": 4,
          "maxItems": 4,
          "uniqueItems": true,
          "items": {
            "type": "string",
            "minLength": 1
          }
        }
      }
    }
  }
}
