{
  "$schema": "./schemas/bible-connections.schema.json",
  "game": "bible-connections",
  "version": 1,
  "displayName": "Bible Connections",
  "roundsPerSession": 3,
  "sessions": [
    {
      "id": "bc-session-001",
      "title": "Connections Pack 001",
      "theme": "Bible term groups",
      "rounds": [
        {
          "id": "bc-r001",
          "title": "Connections Board 1",
          "groups": [
            {
              "id": "bc-r001-g01",
              "category": "Books Of The Law",
              "items": [
                "Genesis",
                "Exodus",
                "Leviticus",
                "Numbers"
              ]
            },
            {
              "id": "bc-r001-g02",
              "category": "Moses Family",
              "items": [
                "Amram",
                "Jochebed",
                "Aaron",
                "Miriam"
              ]
            },
            {
              "id": "bc-r001-g03",
              "category": "Exodus Stops",
              "items": [
                "Succoth",
                "Marah",
                "Elim",
                "Rephidim"
              ]
            },
            {
              "id": "bc-r001-g04",
              "category": "Offerings",
              "items": [
                "Burnt",
                "Grain",
                "Peace",
                "Sin"
              ]
            }
          ],
          "difficulty": "easy",
          "teachingNote": "Review Connections Board 1 and how it connects to the Bible before continuing."
        },
        {
          "id": "bc-r002",
          "title": "Connections Board 2",
          "groups": [
            {
              "id": "bc-r002-g01",
              "category": "Return History Books",
              "items": [
                "2 Chronicles",
                "Ezra",
                "Nehemiah",
                "Esther"
              ]
            },
            {
              "id": "bc-r002-g02",
              "category": "Twelve Apostles A",
              "items": [
                "Peter",
                "Andrew",
                "James",
                "John"
              ]
            },
            {
              "id": "bc-r002-g03",
              "category": "Paul Travel Places",
              "items": [
                "Corinth",
                "Ephesus",
                "Troas",
                "Rome"
              ]
            },
            {
              "id": "bc-r002-g04",
              "category": "Animals In Sacrifice",
              "items": [
                "Bullock",
                "Ram",
                "Lamb",
                "Turtledove"
              ]
            }
          ],
          "difficulty": "medium",
          "teachingNote": "Review Connections Board 2 and how it connects to the Bible before continuing."
        },
        {
          "id": "bc-r003",
          "title": "Connections Board 3",
          "groups": [
            {
              "id": "bc-r003-g01",
              "category": "Minor Prophets A",
              "items": [
                "Hosea",
                "Joel",
                "Amos",
                "Obadiah"
              ]
            },
            {
              "id": "bc-r003-g02",
              "category": "High Priests",
              "items": [
                "Eli",
                "Abiathar",
                "Zadok",
                "Caiaphas"
              ]
            },
            {
              "id": "bc-r003-g03",
              "category": "Judges Places",
              "items": [
                "Ophrah",
                "Timnah",
                "Shiloh",
                "Mizpah"
              ]
            },
            {
              "id": "bc-r003-g04",
              "category": "More Revelation Churches",
              "items": [
                "Sardis",
                "Philadelphia",
                "Laodicea",
                "Patmos"
              ]
            }
          ],
          "difficulty": "hard",
          "teachingNote": "Review Connections Board 3 and how it connects to the Bible before continuing."
        }
      ]
    },
    {
      "id": "bc-session-002",
      "title": "Connections Pack 002",
      "theme": "Bible term groups",
      "rounds": [
        {
          "id": "bc-r004",
          "title": "Connections Board 4",
          "groups": [
            {
              "id": "bc-r004-g01",
              "category": "Gospels",
              "items": [
                "Matthew",
                "Mark",
                "Luke",
                "John"
              ]
            },
            {
              "id": "bc-r004-g02",
              "category": "Judges",
              "items": [
                "Deborah",
                "Gideon",
                "Jephthah",
                "Samson"
              ]
            },
            {
              "id": "bc-r004-g03",
              "category": "Tabernacle Items",
              "items": [
                "Ark",
                "Altar",
                "Lampstand",
                "Veil"
              ]
            },
            {
              "id": "bc-r004-g04",
              "category": "Miracles",
              "items": [
                "Water to wine",
                "Storm calmed",
                "Lazarus raised",
                "Blind man healed"
              ]
            }
          ],
          "difficulty": "easy",
          "teachingNote": "Review Connections Board 4 and how it connects to the Bible before continuing."
        },
        {
          "id": "bc-r005",
          "title": "Connections Board 5",
          "groups": [
            {
              "id": "bc-r005-g01",
              "category": "Pastoral Letters",
              "items": [
                "1 Timothy",
                "2 Timothy",
                "Titus",
                "Philemon"
              ]
            },
            {
              "id": "bc-r005-g02",
              "category": "Twelve Apostles B",
              "items": [
                "Philip",
                "Bartholomew",
                "Thomas",
                "Matthew"
              ]
            },
            {
              "id": "bc-r005-g03",
              "category": "Kingdom Capitals",
              "items": [
                "Samaria",
                "Damascus",
                "Nineveh",
                "Babylon"
              ]
            },
            {
              "id": "bc-r005-g04",
              "category": "Offerings",
              "items": [
                "Burnt",
                "Grain",
                "Peace",
                "Sin"
              ]
            }
          ],
          "difficulty": "medium",
          "teachingNote": "Review Connections Board 5 and how it connects to the Bible before continuing."
        },
        {
          "id": "bc-r006",
          "title": "Connections Board 6",
          "groups": [
            {
              "id": "bc-r006-g01",
              "category": "Pentateuch People",
              "items": [
                "Adam",
                "Noah",
                "Abraham",
                "Moses"
              ]
            },
            {
              "id": "bc-r006-g02",
              "category": "Foreign Rulers",
              "items": [
                "Pharaoh",
                "Nebuchadnezzar",
                "Cyrus",
                "Herod"
              ]
            },
            {
              "id": "bc-r006-g03",
              "category": "Temple Furnishings",
              "items": [
                "Sea",
                "Lavers",
                "Cherubim",
                "Pillars"
              ]
            },
            {
              "id": "bc-r006-g04",
              "category": "Animals In Sacrifice",
              "items": [
                "Bullock",
                "Ram",
                "Lamb",
                "Turtledove"
              ]
            }
          ],
          "difficulty": "hard",
          "teachingNote": "Review Connections Board 6 and how it connects to the Bible before continuing."
        }
      ]
    },
    {
      "id": "bc-session-003",
      "title": "Connections Pack 003",
      "theme": "Bible term groups",
      "rounds": [
        {
          "id": "bc-r007",
          "title": "Connections Board 7",
          "groups": [
            {
              "id": "bc-r007-g01",
              "category": "Poetry Themes",
              "items": [
                "Praise",
                "Wisdom",
                "Vanity",
                "Love"
              ]
            },
            {
              "id": "bc-r007-g02",
              "category": "United Monarchy",
              "items": [
                "Saul",
                "David",
                "Solomon",
                "Jonathan"
              ]
            },
            {
              "id": "bc-r007-g03",
              "category": "Return Places",
              "items": [
                "Jerusalem",
                "Bethany",
                "Emmaus",
                "Nazareth"
              ]
            },
            {
              "id": "bc-r007-g04",
              "category": "More Revelation Churches",
              "items": [
                "Sardis",
                "Philadelphia",
                "Laodicea",
                "Patmos"
              ]
            }
          ],
          "difficulty": "easy",
          "teachingNote": "Review Connections Board 7 and how it connects to the Bible before continuing."
        },
        {
          "id": "bc-r008",
          "title": "Connections Board 8",
          "groups": [
            {
              "id": "bc-r008-g01",
              "category": "Early History Books",
              "items": [
                "Joshua",
                "Judges",
                "Ruth",
                "1 Samuel"
              ]
            },
            {
              "id": "bc-r008-g02",